{"repository":{"owner":"theLucius7","name":"CompetitiveProgramming","branch":"main"},"generatedAt":"2026-09-08T00:59:16.099Z","sourceRef":"origin/main","commits":[{"sha":"7cca2a682247670b87af2c8bb9755acda9e434e5","subject":"Merge pull request #1 from theLucius7/cleanup-shortestpath-layout","committedAt":"2026-09-04T02:54:39.000Z","url":"https://github.com/theLucius7/CompetitiveProgramming/commit/7cca2a682247670b87af2c8bb9755acda9e434e5"},{"sha":"2fbd913044d3518c0dde92327c2619fa742d0f91","subject":"enable ShortestPath CPH rules in VS Code","committedAt":"2026-09-02T08:08:44.000Z","url":"https://github.com/theLucius7/CompetitiveProgramming/commit/2fbd913044d3518c0dde92327c2619fa742d0f91"},{"sha":"7f141f0b245572aab09dccce4e08d660e3fb2d12","subject":"remove backup copies and flatten draft files","committedAt":"2026-09-02T07:53:47.000Z","url":"https://github.com/theLucius7/CompetitiveProgramming/commit/7f141f0b245572aab09dccce4e08d660e3fb2d12"},{"sha":"9e821860a246cff40c6573dfa7b4c78d1f2f52e4","subject":"reorganize solutions for ShortestPath IDE","committedAt":"2026-09-02T07:48:58.000Z","url":"https://github.com/theLucius7/CompetitiveProgramming/commit/9e821860a246cff40c6573dfa7b4c78d1f2f52e4"},{"sha":"fdca917e56e211ebd85368f4e3dec44bd994ae7c","subject":"qwq and ovo and o0o","committedAt":"2026-08-27T12:47:12.000Z","url":"https://github.com/theLucius7/CompetitiveProgramming/commit/fdca917e56e211ebd85368f4e3dec44bd994ae7c"},{"sha":"7df6fde30b48b968918e28d3bb9cbb5ead5814b5","subject":"qwq and ovo and o0o","committedAt":"2026-08-24T11:25:56.000Z","url":"https://github.com/theLucius7/CompetitiveProgramming/commit/7df6fde30b48b968918e28d3bb9cbb5ead5814b5"}]}
